url,category,search_term,title,company,location,salary,job_type,description,posted_date,region
https://www.caribbeanjobs.com/IT-Manager-Job-226839.aspx,information_technology,Systems Administrator,IT Manager,Popular Locations,,,,"IT Manager Barbados Civil Aviation Authority Christ Church Not disclosed Permanent full-time Updated 11/02/2026 Apply Now Share Share this job Facebook Twitter Report This Job Save Save The IT Manager oversees and secures the Authority’s ICT systems to support regulatory excellence and operational efficiency, aligning technology and data assets with BCAA’s objectives while ensuring high-quality aeronautical information systems and compliance with international aviation standards. IT MANAGER - VACANCY NOTICE The Barbados Civil Aviation Authority (BCAA) is seeking a dynamic, strategic, and results-driven IT Manager to lead and safeguard the Authority’s Information and Communications Technology (ICT) environment. This is an exciting leadership opportunity for a forward-thinking ICT professional ready to drive innovation within a highly regulated and mission-critical environment. POSITION OVERVIEW This senior role is responsible for overseeing, managing, securing, and optimizing the Authority’s computer and ICT systems to support regulatory excellence and operational efficiency. The successful candidate will ensure that the BCAA’s technological and data assets are aligned with the Authority’s performance objectives, enabling the delivery of high-quality aeronautical information management systems and supporting Barbados’ compliance with international aviation standards. KEY RESPONSIBILITIES Lead the strategic, organizational, and operational planning of the Authority’s information systems. Manage, monitor, and secure the BCAA’s ICT and data assets, including cyber security, access controls, back-up procedures, operational continuity, and disaster recovery. Identify, recommend, and implement cost-effective ICT solutions including procurement, integration, upgrades, and system enhancements. Develop and manage the annual Information Systems budget. Oversee network infrastructure, servers, installations, migrations, and system performance to ensure reliability, stability, and availability. Supervise and guide IT personnel in network and systems administration. Ensure adherence to IT governance policies and regulatory compliance requirements. Provide expert technical advice and strategic recommendations to Senior Management. Foster innovation, continuous improvement, and effective user support across the Authority. Establish and maintain strategic partnerships with ICT service providers. Participate in policy development, service quality initiatives, and cross-functional projects. Represent the Authority at seminars, workshops, and professional forums. Perform other related duties as may be reasonably assigned. QUALIFICATIONS & EXPERIENCE A Master’s Degree or equivalent postgraduate professional designation in Computer Science, Information Technology, or related field, plus a minimum of three (3) years’ relevant experience in a similar leadership role; OR A Bachelor’s Degree or equivalent postgraduate professional designation in Computer Science, Information Technology, or related field, plus a minimum of five (5) years’ relevant experience in a similar leadership role. Candidates should also demonstrate: Expert knowledge of network administration. Advanced experience in data security and ICT systems management. Strong understanding of IT governance, compliance, and risk management. Working knowledge of the Barbados Civil Aviation Act and Regulations. Experience managing aeronautical information management services in accordance with ICAO Annex 15 and ISO 9001 standards (an asset). Experience with Geographic Information Systems (GIS) (an asset). Proven track record of high performance and leadership. Ability to manage multiple projects under pressure and deliver results within prescribed timelines. Strong analytical, troubleshooting, and systems-thinking capabilities. CORE COMPETENCIES & SKILLS: Exceptional customer and systems user support skills. Strategic thinking and innovation. Strong organisational, planning, budgeting, and project management skills. Critical thinking and sound professional judgement. Rigorous attention to detail. Data-driven decision-making and thorough documentation practices. Integrity, impartiality, and professionalism. Ability to work effectively within a multi-disciplinary regulatory environment. Ref: IT Manager Apply Now",,Caribbean
https://www.caribbeanjobs.com/Barbados-Civil-Aviation-Authority-Jobs-5242.aspx,information_technology,Systems Administrator,Barbados Civil Aviation Authority,Popular Locations,,,,"Barbados Civil Aviation Authority The Barbados Civil Aviation Authority (BCAA) is the regulatory body responsible for the oversight and regulation of civil aviation activities in Barbados. Established to ensure the safety, security, and efficiency of the aviation industry, the BCAA plays a crucial role in the development and implementation of aviation policies, standards, and procedures in alignment with international best practices. Email Me Jobs From This Recruiter",,Caribbean
https://www.caribbeanjobs.com/Compliance-IT-Audit-Lead-JESS-Job-222553.aspx,information_technology,Systems Administrator,Compliance IT Audit Lead (JESS),Popular Locations,,,,"Compliance IT Audit Lead (JESS) KPMG Jamaica (JESS) Kingston and St. Andrew / St. Ann / St. Catherine Not disclosed Permanent full-time Updated 23/01/2026 HR Log in or register to apply Share Share this job Facebook Twitter Report This Job Save Save In this role, you will be responsible for executing high-level compliance audit and develop and implement comprehensive IT and Security Risk Management plans, utilizing your expertise to enable leadership to make informed, risk-based decisions. Compliance Audit Lead Location : Kingston, Jamaica (KPMG Jamaica Extended Support Services: JESS) Join JESS, KPMG Jamaica’s delivery center, supporting KPMG U.S. with mission‑critical IT compliance and risk programs. As Compliance Audit Lead, you’ll execute high‑level audits against ISO standards, drive cross‑disciplinary IT & Security risk management plans, and influence leadership decisions that lower enterprise risk. What you’ll do: Lead compliance audits under ISO/IEC 27001 and ISO/IEC 42001 frameworks, ensuring alignment with risk, compliance, information security, and privacy standards. ​Develop and implement a comprehensive IT & Security Risk Management plan; translate risk insights into clear, actionable recommendations for leadership. ​Analyze key risks and trade‑offs; advise on strategies to minimize overall risk posture. ​Track changes in the operating environment and adjust risk approaches to reflect best practices. ​Oversee projects end‑to‑end; manage timelines, expectations, and deliverables. ​Coach and mentor junior staff; review audit workpapers for quality, timeliness, completeness, and accuracy. ​Manage control evidence requests: collect, evaluate, accept/reject artifacts, and provide feedback to stakeholders. Must‑have qualifications & experience: Bachelor’s degree in Risk Management, Business Administration, Information Technology, or a related field. ​3+ years of relevant IT audit experience, ideally within a large professional services environment. ​Direct experience with ISO/IEC 27001 and/or ISO/IEC 42001—control evaluation, mitigating controls, identifying control deficiencies, and facilitating remediation. ​Working familiarity with PCAOB, SOC 1/2/3, AICPA, ISO, COBIT, CSA, ITIL, and related IT/InfoSec frameworks. ​Strong verbal/written communication, problem‑solving, analytical, and independent judgment skills in a customer‑service, team‑oriented environment. ​Proven ability to work independently and collaborate effectively across teams. ​Excellent organization & time management; dependable with deadlines. ​Proficiency in Microsoft Word, Excel, PowerPoint, and Outlook. Nice‑to‑have certifications: CISA, CISM, CISSP, or ISO/IEC 27001/42001 Lead Auditor. Business competencies: Communication : Clear, effective, and accountable. ​ Customer Service : Quality outcomes for internal and external stakeholders. ​ Collaboration & Teamwork : Cooperative, results‑oriented partnerships. ​ Stakeholder Management : Build strong relationships; influence at all levels. Technical competencies: Problem‑Solving: Apply logic, judgment, and data to recommend solutions. ​Ethics Knowledge: Understand and promote compliance with statutes, regulations, policies, and procedures. ​Information Systems Administration: Practical knowledge of systems concepts and practices. ​Data Gathering & Analysis: Collect, synthesize, and interpret information objectively to inform strategic decisions. ​ Special Conditions: JESS uses a hybrid work model, allowing staff to work from home in Jamaica or in the office. Employees must be in the office at least five days per month, with more days possible if required by business needs. You are expected to use KPMG-approved Generative AI tools to support your daily work tasks. Expected to work in a fast-paced team environment. Will be working primarily in a paperless environment and expected to be using information systems for the entire workday to access data or perform activities. May be required to work extended hours periodically or on public holidays. Why JESS: At JESS, you’ll partner with U.S. leaders on complex risk initiatives, grow your audit & GRC expertise, and contribute to KPMG’s purpose: Inspire Confidence. Empower Change. We offer a professional environment committed to learning, inclusion, and performance excellence. Is this job for you? If YES, please view the Job Description and APPLY on our job webpage immediately below: Compliance Audit Lead APPLY HERE . Learn more about us here : K-JESS Homepage © 2025 KPMG Jamaica Extended Support Services Limited, a company incorporated in Jamaica and a member firm of the KPMG global organization of independent member firms affiliated with KPMG International Limited, a private English company limited by guarantee. All rights reserved. Ref: Compliance Audit Lead (JESS) Log in or register to apply",,Caribbean
https://www.caribbeanjobs.com/KPMG-Jamaica-JESS-Jobs-3538.aspx,information_technology,Systems Administrator,KPMG Jamaica (JESS),Popular Locations,,,,KPMG Jamaica (JESS) Email Me Jobs From This Recruiter,,Caribbean
https://www.caribbeanjobs.com/Human-Resources-Generalist-Job-225092.aspx,information_technology,Systems Administrator,Human Resources Generalist,Popular Locations,,,,"Human Resources Generalist The Crane (Millennium Investment Ltd) Christ Church / St. Phillip / Bridgetown Not disclosed Permanent full-time Updated 13/01/2026 HR Log in or register to apply Share Share this job Facebook Twitter Report This Job Save Save The Human Resources Generalist will support the strategic and day-to-day HR activities in alignment with organizational and HR goals and objectives with leaders and employees at all levels in the organisation to provide HR support and guidance. Company Overview: Millennium Investments is a leading force in construction and real estate development, with a legacy of creating world-class properties like The Crane Resort. Our commitment to innovation, quality, and excellence drives every project we undertake. We’re seeking a hands-on HR Generalist to join our dynamic team and play a key role in supporting the human resources function within our organisation. Applications open to Barbadian nationals or persons with permission to reside and work in Barbados. Role Overview: The Human Resources Generalist will support the strategic and day-to-day HR activities in alignment with organizational and HR goals and objectives with leaders and employees at all levels in the organisation to provide HR support and guidance.  This role provides services in employee programs, recruitment, selection, workplace investigations, disciplinary process, employee relations and performance management.  Independently delivers a broad range of human resources management advice, guidance and services to employees and leaders to foster a culture of productivity and engagement. Main Key Responsibilities: •  Assist in all activities concerning sourcing, recruitment and selection including development of job descriptions, managing job postings, and facilitate timely and successful selection and hiring processes. •  Facilitate onboarding and participate in new-hire orientation programs for personnel at all levels. •  Assist with implementation of employee engagement activities, events and practices. •  Provide coaching to leaders and line-staff to encourage effective communication and problem resolution. •  Manage employee relations by addressing employee concerns, resolve workplace conflicts, and promote a positive work environment, ensuring that company policies, practices and employee resources are fairly and consistently applied. •  Conduct workplace investigations, performance management meetings, employee disciplinary/grievance hearings in accordance with organisational standards and processes. •  Conduct exit interviews with employees leaving the organization via resignation and assist in determining any trends and issues affecting retention. •    Monitor probationary periods, performance appraisal cycles, ensuring follow-up and follow-through. •    Assist with managing, maintaining and administering personnel administration systems, confidential files, employee records and HR Information systems. •    Collaborate with and assist the HR Development and Learning Business Partner teams in carrying out learning and development programs, departmental standards and processes. Desired Qualities: •    Independently resolve issues by demonstrating judgement and discretion and seek guidance for complex issues. •    Demonstrate a high level of ethical conduct and ability to maintain confidentiality of sensitive information. •    Foster positive employee relations at all levels throughout the organization. •    Contribute to process improvements and best practices. •    Ability to prioritize, organize workflow, and use time efficiently. •    Ability to perform at high levels in a fast-paced, ever-changing work environment and to pivot quickly, responding with flexibility to changing priorities and work demands. •    Ability to act with discretion, tact, and professionalism in all situations. •    Ability to work independently and collaboratively. •    Strong organisational and time-management skills. •    Strong written communication skills required with the ability to work well in a multi-generational work environment. •    Able to communicate effectively with guests, management, contractors, suppliers and co-workers. Required Skills & Qualifications: •    Experience: A minimum of 3-5 years of experience in an HR Coordinator/Officer role or similar. •    Minimum of five (5) years working knowledge of HR practices or an equivalent combination of education and experience. •    Demonstrable experience in human resources management and human resources practices, (preferably, but not limited to the hospitality industry). •    Proficient in use of computer technology, Microsoft Office and HR-related software. •    Up to date working knowledge of relevant Barbados Employment Legislation and local HR customs and practice. •    A related bachelor's degree may be considered an asset in combination with experience. Applications close on Monday January 26, 2026 Please note that only suitably qualified applicants will be invited to interview. Ref: Human Resources Generalist Log in or register to apply",,Caribbean
https://www.caribbeanjobs.com/The-Crane-Millennium-Investment-Ltd-Jobs-2141.aspx,information_technology,Systems Administrator,The Crane (Millennium Investment Ltd),Popular Locations,,,,The Crane (Millennium Investment Ltd) Email Me Jobs From This Recruiter,,Caribbean
